,0
800, This is the epidemic that was happening underneath the pandemic
801, It didn't go away
802," Our state is making progress on addressing this crisis through our great Department of Human Resources and the small, but mighty Recovery Reinvented team"
803," And while we're making great strides, there are still areas of our state where more help is needed"
804,"   Jonathan and Nicole Franklin of Harvey, North Dakota"
805, They know this all too well
806," After a game of pickup basketball at the local Armory, Jonathan was visiting with a group of high schools"
807, He realized that four of the parents of the kids that were there playing ball had died by suicide
808, These were people that he knew from his own school days in Harvey
809," No counseling center in town, Jonathan and Nicole, a licensed clinical social worker and a therapist, they took matters into their own hands"
810,  They purchased and rehabbed a vacant building on Harvey's main street
811, They launched the Mosaic Wellness Center
812, Now children and adults have somewhere local to go for counseling services
813, We're grateful to have such caring community members in our state
814," And while the Franklins’ story is unique, the need for more mental health and addiction services across North Dakota is not"
815, Behavioral health must continue to be a top priority
816, We've got to keep expanding critical behavioral health services
817," We've got to be reaching those in need sooner, and we've got to reach them closer to home"
818," And we've got to support telehealth as part of this   solution, including telehealth from providers that may not have a physical location in our state"
819," Collaborating with the legislature, the state has provided resources for schools to support behavioral health needs of students and to help prevent the tragedy of suicide"
820,  We've increased funding to improve access for addiction programs
821, We've expanded behavioral health crisis services to all regions of the state
822, And we've launched new recovery programs that include supportive housing
823, But there's more to be done
824," And we'll continue to meet these challenges through collaboration, through innovation and action"
825,"   One way we ask you to join us in this is to encourage you to save the date and join us for the next Recovery Reinvented, November 10th at Alerus Center in Grand Forks"
826," This last year, there was over 800 people in-person and close to 3,500 people watching online, including people watching from all of our corrections facilities across the state"
827,   Recovery Reinvented began with First Lady Kathryn bravely sharing her personal story of recovery
828," Five years later, Recovery Reinvented continues to inspire individuals across North Dakota and the nation to find hope in recovery, and to most importantly, eliminate the shame and stigma of addiction"
829,  Our great Human Services Behavioral Health team continues to drive program innovation that leads our nation
830," But this Saturday, February 19th is a very special day"
831," I'd like you all to join me in congratulating and thanking, for her courage and passion, for her living one day at a time as our first lady reaches her 20th year sobriety birthday, this Saturday"
832," Congratulations, Kathryn"
833," And that's harder than you think, staying sober and being married to me"
834," That's a hard thing to do, but congratulations"
835, Wow
836,"  ***  North Dakotans have always been dedicated to solving problems, creating communities that will support and inspire future generations"
837,"   We are innovators as North Dakotans, like Jake from Bushel, like Dorothy from Dot's"
838,"   We help each other, like Jonathan and Nicole supporting their neighbors and those children in Harvey and their need"
839,"   We help our neighbors, like the firefighters that we introduced earlier"
840,"   And we help our neighbors and even people we don't know, like the first lady courageously reducing stigma"
841,"   We're community builders as North Dakotans, like Maxum at Frost Fire, and like Nick Ybarra on the Maah Daah Hey Trail"
842,"     Positive, inspiring efforts like these are happening across our state every single day, countless selfless North Dakotans who are focused on creating and advancing solutions"
843, They believe in themselves
844, They believe in our youth
845, They believe in the goodness of their neighbors and their communities
846,"  But often today, these incredible selfless efforts fall under the radar"
847," They're drowned out by the noise of the angriest post on social media or the hottest trending ""outrage"" or ""be afraid"" story that may not even be relevant to North Dakota, may not even be true"
848, But that noise drowns out the goodness of North Dakotans
849,"   Nearly a century ago, Dr"
850, Henry J
851," Moore, he had a powerful, audacious vision to plant a massive garden right on the international border as the symbol of peace and friendship between the United States and Canada"
852," Last August, we continued the friendship and dedication to peace with an announcement of a $5 million legislative approved grant that was then matched by our Manitoba neighbors"
853, And we had a chance to celebrate that at the border with the premier of Manitoba
854, This July 14th will mark the 90th anniversary of the dedication of the Peace Garden
855," In 1932, some 50,000 people traveled from all over the two countries to celebrate that groundbreaking"
856," And if you saw that picture up there, you could see that they had a very good parking attendant at that event too"
857, I don't know if they kept the Canadian cars in Canada and the U
858,S
859, cars in the U
860,S
861,"   But we know that United States and Canada didn't agree on everything 90 years ago, and we still don't agree on everything today"
862, But we can learn a lesson from those efforts to focus on what unites versus focusing on what divides us
863,"  Edward Everett Hale, the 19th century author and historian, is credited with saying, ""Coming together is the beginning; Keeping together is progress; Working together is success"
864,"""   We can work together in North Dakota to overcome division"
865, We can work together to break through the noise
866, We can work together to attract new residents to our state
867, And we can work together to entice the youth and adults and grandparents alike to stay and build a better life here
868," We can work together to build relationships that aren't based on judging and labels and assumptions, but build relationships that are based on curiosity, on humility, on gaining understanding and mutual respect"
869,"  And we can do a better job, all of us, of telling our North Dakota story, that we have incredible opportunity"
870," And not just telling this story to outsiders that we're trying to move here to put value at it, but we got to tell a better story of telling it to our own children and grandchildren right here"
871, They are our state's future
872,"   The common thread that reflects our heritage, that reflects who we are as North Dakotans, is that we –  and this is what will differentiate us against all other places as we compete for this talent and capital"
873," If we're the state that puts our youth – and I'm talking child care, youth, pre-K, kids in school, college kids – when we put our youth, and then when we put our communities,   ahead of ourselves, we can create an amazing future"
874, That's happening right now in some communities in North Dakota
875,"  When we do this, we will keep growing stronger by the day, because that's what will represent our truly unshakable faith in the unlimited potential of North Dakota and its people"
876,   So let us leave here today and unite together
877, Let's unite with courage
878, Let's unite with gratitude
879," And let's do that in our spirit of Empowering People, Improving Lives and Inspiring Success"
880,   Thank you
881, God bless you all
882, God bless the Great State of North Dakota
883, God bless the United States of America
884,  ***  
