,0
0," Governor Doug Burgum 2022 State of the State Address February 16, 2022 Fargo Theatre  Good morning"
1," Good morning, everyone"
2, Thank you for being here in person and thanks for those that are watching online
3, I want to say welcome to everybody
4," First Lady Kathryn, my sons Joe and Tom, my daughter Jesse who is watching online, my sister Barbara and the other Burgums in the family"
5," I think everybody knows, as Brent said, when you're serving in these roles today, whether it's city commission, county commission, state legislator, any elected official the last two years, you're not in this thing alone, you’re in it and your family’s with you"
6," So again, I want to say thanks to my amazing family and a special welcome"
7, Now I've got a son who's engaged
8," So welcome, Simone"
9, Looking forward to the June wedding
10, So way to go
11, Congratulations
12,"  We've had an incredible year of progress in North Dakota, and people that are here been watching and listening"
13," Lots of exciting announcements related to value-added energy, value-added agriculture, economic development"
14," And of course, right at the forefront, pushing tirelessly to get these projects over the finish line has been one person"
15," A lot of people work to make all these happen, but I’ve got to tell you, Lieutenant Governor Brent Sanford, and all these things that are happening and all these announcements, he's at the front, he's behind the scenes, or he's leading the way making it happen"
16, We've got the best Lieutenant Governor in the nation
17, Let's give it up for Brent Sanford
18,"  As we settle into the year 2022, I think everybody here understands that the world today is a complex, changing dynamic and there are conflicts between regions and powers and superpowers and countries all over the world that at any moment may boil over"
19," And here at home, our nation, as we come out of COVID, everything's emotionally charged and politically divided"
20, In D
21,C
22,", we know we've got an administration that's pursuing regulations and policies that actually create headwinds for our two largest industries, energy and agriculture"
23,   And mainstream and social media seem to be at the forefront of everyone's thinking
24, They're competing for all of our attention all the time
25, And these are businesses that are driven by advertising supported models
26," Whether it's social media, mainstream media, they are competing for all of our attention"
27," And the best way to get us to click on something or view something or try to pay attention to something is to convince us what we should be fearing the most, what we should be afraid of, what we should be most shocked about, and that creates a dynamic for the whole country"
28,"  But right here in North Dakota, in the reality, on the ground, it's different from what you may see either nationally or internationally"
29," In North Dakota, examples even this week, where we can   get together quickly and easily and frequently get all the people together in the same room and on the same page and make things happen"
30,   Hardworking North Dakotans know that we're in the business of feeding and fueling the world
31," And as such, we're not in competition with our friend, our neighbor, the person we've never met on Facebook"
32," We're in competition with other states, and our state is in competition with other nations"
33, We're competing for talent and for workforce
34, We're competing to retain our youth and our adults
35, We're competing for the capital investment to help our state reach its fullest potential
36,   To be a North Dakotan in 2022 means that we're living in a land of incredible opportunity
37, Ours is clearly a state that's been blessed with abundant natural resources and some of the richest and most productive soil
38," We cherish our wide open spaces, the beauty of our diverse landscapes, our endless skies and our stunning sunsets"
39," Regardless of the temperature outside, it's always beautiful in North Dakota"
40," We value our God-given freedoms, perhaps like no other state, and we honor those who fight to protect them"
41,"   It's no wonder that in 2021, why North Dakota was ranked in the top five for the best state to live, the best state for families, and the best state for business friendliness"
42," We've also earned top 10 rankings in the best state for millennials, the best state to retire, the best state to start a business, and the best state for taking care of our natural environment with some of the cleanest air and water in the nation"
43," And certainly at the end of the day, what matters, perhaps most, is many sites have agreed that North Dakota is one of the happiest states in the nation"
44, Let's give yourselves a hand for all of that
45,"  Our population in North Dakota grew faster than all but three other states during the decade between 2010 and 2020, and families from near and far are finding incredible opportunities within our borders"
46,"   Among those, one great example, Miguel Delgado and his wife, Jessica Morales, they're from the U"
47,S
48, territory of Puerto Rico
49," And Miguel earned, like many people in North Dakota have done, an animal science degree in 2014"
50," A friend invited him to take a vacation in Mandan, North Dakota"
51, He instantly fell in love with the land and the scenery
52, He found a job at a local cattle ranch and decided with Jessica to move to North Dakota
53,"   After the pandemic hit, one evening they were sitting with friends and they decided that North Dakota needed an authentic, Latin bakery"
54, Miguel felt that he could recreate his family's generational recipes
55," The couple did what entrepreneurs and risk takers do, they invested everything they had to launch El Coqui Bakery in south Bismarck in November 2020 with co-owners Jossef Feiner and Dyna Mena"
56,   Today that business is thriving
57," Miguel, Jessica, Jossef and Dyna are busy running a bakery and they couldn't be here today, but we know they're watching online"
58," So please join me in   welcoming them as some of the more than 100,000 new residents that have decided in the last decade to call North Dakota home"
59, Welcome
60,  The 2020 census also revealed that we're now the fourth-youngest state
61, This is a complete reversal from when we were one of the oldest states
62, We've got a number of students that are here in the room
63," Again, thank you to the Governor's Band and Choir"
64, And we want to give a shout out to them for helping us be one of the youngest states in the nation
65, And so we want to give a shout out to them
66," But as I hear myself saying that, technically, I guess your parents had a hand in that, anyway, but let's give them a hand for helping us do that"
67,"  ***  And we gave you one example of a startup, but businesses are booming in North Dakota"
68," Last year, we registered more than 30,000 new businesses, well, last two years, 30,000 new businesses in the last two years"
69,"   And on the big scale level, in the past year alone, we've seen announcements and transactions totaling more than $7 billion in capital investment in our energy industry, over $2"
70,"2 billion in announcements about projects coming for value-added agriculture, and there's been over $12 billion invested in North Dakota across bio-manufacturing, unmanned aircraft systems, and other technology-based businesses"
71," That is total investment coming into North Dakota, across energy, ag, and new, emerging technology businesses of over $21 billion"
72,   This isn't happening by accident
73," This massive investment, it's accumulation of years and decades of intentional effort by our state leaders to build a stable business tax and regulatory environment and to build a business friendly North Dakota"
74," So all of you that are here, particularly all the elected officials, current and past, you're all part of that"
75, Give yourselves a hand for that incredible work
76,"  Yes, we think of North Dakota as our Field of Dreams, but that Field of Dreams is becoming a reality"
77, We're attracting remarkable levels of investment
78, We're creating tremendous opportunity for today's workforce and for future generations
79,"  Today, the state of our state is strong and it's growing stronger by the day because of our unshakable faith in the unlimited potential of North Dakota and its people"
80,"  ***  Last year we saw again several historic challenges for our state, but North Dakotans showed that as always, we're up to the task"
81,   Regardless of the peaks and valleys of the ongoing global pandemic we know that keeping our schools open for in-person learning is the best for our students
82, And kudos to all of our teachers and administrators for making that happen
83, Let's give those teachers a round of applause
84,    We've encouraged people to visit with their trusted medical providers about vaccines
85," Vaccines, statistically, remain the best defense against COVID"
86, They drastically reduce the need for hospitalization
87," And as evidence of our focus from the beginning of protecting the most vulnerable, our skilled nursing residents and our staff are boosted and vaccinated at rates well above the national average"
88," And at the same time we will, and we will continue to push back when the federal government overreaches into personal liberty and individuals’ personal health decisions, or if they're overreaching into the rights of private business owners"
89," Washington needs to be reminded, the states created the federal government, not the other way around"
90,"  And during the nearly two years of this battle against the invisible enemy, the COVID virus, the pandemic has stretched our health care facilities and their personnel to their limits"
91,"   Our state's nurses, doctors, hospital and clinic staff, long-term care workers, first responders and others, even as we're here today, they continue to save lives through their tireless efforts"
92," Our state agencies and local public health units have supported them with everything from medical supplies, technical assistance, case reporting, offering and supporting with mass testing events, vaccine clinics, and all of this to help reduce the burden on the health care system so the health care system can take care of not just COVID, but all the health needs of the citizens of North Dakota"
93,"   And on the front line of that, of course, is our nurses"
94," And so to honor the incredible efforts by the state's over 22,000 licensed nurses, we're declaring this week Nurses Week in North Dakota"
95, Please join me in sharing our deepest gratitude for the truly lifesaving work of all of our state's nurses and the heroes of this pandemic
96,"  Of course, North Dakotas are not just known for our resiliency"
97, I think it's a source of pride for people that live here
98," And last year, Mother Nature tested us like never before with the worst drought conditions recorded in our state's 133-year history"
99,"   Using our whole-of-government approach we provided over $6 million in water supply and transportation aid to keep livestock herds watered and fed, leaving no stone unturned to help our farmers and ranchers"
100,"  For the first time in recent memory, our state's firefighters fought intense wildfires in every single month of the year, 2021"
101," Believe it or not, just last month, it marked the one anniversary of a massive January prairie fire along the North Dakota-South Dakota border that kicked off what would become the driest winter on record for our state"
102,"  And who could forget last April when windswept flames threatened to engulf our state's top tourist attraction, the city of Medora, and forced the city's evacuation"
103," We rapidly deployed our 'Always Ready, Always There' North Dakota National Guard"
104," They jumped in their helicopters, they flew west with 600-gallon water buckets to stop the fire and save Medora"
105," And they   collaborated, incredible collaboration among local, state, and federal agencies"
106," They not only saved the city, but they also saved the historic Chateau and the Burning Hills Amphitheater"
107,"   This winter, these firefighters are finally getting a well-deserved break after responding last year to an unprecedented 2,199 fires that consumed over 122,000 acres"
108, That's more than triple the annual number of wildfires in the previous five years
109," And we're so honored and pleased to have some of those firefighter leaders that are here with us today, Ryan, Kyle, Jeff, Josh, Lee, Jimmy, and Rod"
110," These heroes along with all of our state's firefighters who worked together all year to protect lives, prevent millions of dollars of property damage across the state, have our deepest appreciation"
111, Let's have those firefighters stand
112, Let's give them a big hand
113, Thank you for everything you've done
114,"  And while smoke and flames make wildfires noticeable by virtually anyone, makes for great photos for the press and the papers"
115," Our state continues daily, to face a far less visible threat"
116, And it is a threat
117," It's largely out of the public eye, but there continues to be a war on our state and our country led in many cases by state-sponsored cyberattacks"
118," When I say state-sponsored, we're talking China, Russia, Iran, North Korea, leading the pack"
119,"   Last year, the state of North Dakota defended against 4"
120,"5 billion, yes, that's billion with a B, 4"
121,5 billion attacks on state government
122," That includes K-12, higher education, and anybody else that's touching our state network"
123, That's more than double the number of attacks from two years ago
124, We have set up automated defense systems that stop most of those attacks
125," But our small set of team members at NDIT still had to handle over 50,000 cyberattack incidents last year"
126,   More must be done to protect our citizens trusted information and our way of life
127," Cyberattacks, ransom attacks, all too common these days"
128, It makes cybersecurity education more important than ever
129," We can and should be, we came close in the special session, we need to get it over the finish line, but we can be the first state in the nation to adopt computer and cyber science graduation standards for everybody in K-12 through college, through graduate school"
130," Our PK-20W initiative, which reflects every student from kindergarten through Ph"
131,D
132,", has already won awards for its statewide approach to computer science and cyber education in workforce training"
133,"  And speaking of awards, last weekend we held the first ever Cyber Madness Tournament in North Dakota"
134, And I want to say congratulations to the team from James Valley Career & Technology Center
135," These are high school students from Jamestown, Montpelier, Gackle-Streeter school districts"
136, They put their test against teams from all over the state
137, They put their skills to work
138, They came out on top
139, They won the competition
140, That team is here today
141," Please help me in congratulating Coach Heinert and team members, Jordan, Collin, Karl, and Mason"
142,   So cool
143, Did you guys have fun at Cyber Madness? Fun to come out on top? That's awesome
144, I love that you got class B and class A schools all working together on the same team
145, Was there anybody from Jamestown or was it all class B kids? One? Okay
146, All right
147, They let one class A kid   in
148," The First Lady's happy, Jamestown was represented"
149, There we go
150, Good job
151, Her home school
152," Anyway, but that's our future"
153," Defending our state, defending our nation"
154, Thank you
155,"  We are also the first state to authorize central, shared service approach to cybersecurity across all aspects of state government"
156," And our state network has 252,000 daily users"
157, We have over 400 entities
158, That gives us a surface area that's equal to a Fortune 50 company
159," Last spring, we signed milestone legislation that helped us defend against cyberattacks"
160," We also invested more than $15 million to enhance the state's cybersecurity software initiatives, and thank you legislature for that, but we're still facing huge risks"
161,  It is our duty as a state government to protect our citizens’ data and their digital livelihoods
162," In the 2023 session, looking ahead to that, we've got to advance additional investments in cybersecurity defenses"
163,"   ***  In November, we worked really closely with the legislature on a super successful special session"
164, It's only the 16th special session in our state's history
165," We passed in five, quick days, historic tax relief"
166," We strategically invested hundreds of millions of dollars of federal funding, not in filling budget holes"
167, We invested it in important projects with high return on investment with matching dollars that will help drive our state forward
168, And the legislature completed the legislative redistricting
169,"   Thanks to the legislative leadership and the strong starting point that came out of the work that we did with the legislators, and Brent and I, with the work and all the agencies on the Accelerate ND plan, again, that special session wrapped up in just five days, limiting the cost to taxpayers and probably the most productive five days in the history of the state in a legislative session"
170,"  Now, a lot of credit goes to the legislative leaders"
171, Three of those legislative leaders have since announced that their current term in office will be their last
172," Senate Majority Leader Rich Wardner of Dickinson, House Majority Leader Chet Pollert of Carrington, Senate Minority Leader Joan Heckaman of New Rockford"
173," They have all served their constituents and they've served all of North Dakota with dignity, they've served with grace, they've served with compassion, and they've served with courage"
174," Replacing these fine public servants will not be easy and they'll be dearly missed, we'll miss working with them on behalf of our citizens"
175, They're here today
176," Please join me in thanking Senator Heckaman, Representative Pollert, and Senator Wardner for their exceptional service"
177,"  That may be the last time you see Chet's face, because you're just going to see the back of his head on a motorcycle heading out of here"
178, That's what he's got planned
179," So we wish you well, thank you"
180," Thank you, Chet"
181, Thank you Rich
182," And thank you, Joan"
183,"  ***    Across our work in state government, of course it's a priority that we continue to engage with our tribal partners"
184, Our tribal partners are sovereign nations with which we share geography
185," The tribal enrolled members are also citizens of North Dakota, and it's our job as elected leaders in North Dakota to serve all citizens of North Dakota"
186,"   Last year, we reached an agreement with MHA Nation over the sharing of tax revenue on wells that straddled the edge of the Fort Berthold reservation"
187, This settlement helped take care of an unresolved tax agreement with the Three Affiliated Tribes and added that
188," In October, Chairman Fox and I, that was a great point of collaboration"
189,"   In October, there was more"
190," Chairman Fox and I signed what could be the first of what we hope will be many, including with all the tribes, mutual aid agreements with our tribal nations, allowing the nearest available law enforcement officer to respond to an emergency call, regardless of jurisdiction"
191,"  Folks, it's 2022"
192, It's America
193, A 911 dispatcher in our state should not have to ask someone if they're an enrolled member or not before they can determine which law enforcement agency can respond to an emergency in their home
194," This MOU that we signed with MHA, which MHA spans five counties, takes care of state, county, local, tribal"
195, Everybody in law enforcement's protected
196, Everybody knows how to make it work
197, All the tribes can benefit from this kind of agreement
198, I want to thank everybody on the North Dakota Highway Patrol team that helped make that happen
199,  The legislature also advanced a bill that would allow all tribes to sign collaboration agreements with the North Dakota IT Department to enter into agreements with the tribes to assist them with cybersecurity response
200, This is also super important because our networks are integrated
201," We've celebrated victories together with our tribes, but there's so much more work to be done"
202," But I can tell you from the meetings that we've had in the last six months, the spirit of collaboration is alive and well between the state of North Dakota and the tribes"
203,"  We all have a common desire to work for solutions to the challenges for the benefit of all North Dakotans, including the tribal members living across our great state"
204, These are our neighbors and our fellow citizens
205,  ***  Living in the land of the free and the home of the brave is something for which I know that we're all grateful
206," In North Dakota, we value and respect police officers who enforce the law, and we value and respect military service members who defend our most cherished freedoms"
207," As some states, and some of the iconic major cities of our nation, in the last two years have somehow chosen to tolerate lawlessness, they've chosen to defund their police, North Dakota and our cities, we've been backing the blue"
208," Last April, I had the privilege of signing legislation that provides health insurance benefits to the spouse and children of any emergency responder whose life is taken in the line of duty"
209,    And we pray for the safety of our North Dakota National Guard soldiers that are stationed both at home and abroad
210," And when I say at home, I mean including in Texas, securing our southwest border"
211, The states have stepped up to address this incredible border crisis that the current administration apparently refuses to even fix or even acknowledge
212, And we're showing our appreciation for our National Guard soldiers and airmen with more than just words
213, We fully funded the National Guard Tuition Assistance Program
214, We've approved dollars to lease land to expand the training range at Camp Grafton
215," And we've worked with lawmakers to exempt military retirement pay from state income tax, because those who serve their country have already paid society's tab"
216,"  We also extended the exemption to surviving spouses because we know when a family member serves in the military, so does the family"
217, These are small acts of appreciation to honor the courageous service of our military servicemen and women
218, It helps promote workforce participation
219, It will help those that have served in the military in North Dakota to choose to perhaps retire here
220, And it puts us on a path of our goal to make North Dakota the most military-friendly state in the nation
221,"  I'd now like to ask that all current service members, all military veterans, anybody who served in the police forces, or currently serves the police forces, to stand up, so we can express our unending gratitude to all of you"
222, Thank you for your service
223," I see Chairman Fox standing up over here, U"
224,S
225, Marines
226, Native Americans serve at a higher level than any other group in the country
227, Thank you and thank everybody else
228,"  ***  Just as law and order is essential to safe, healthy communities, so is infrastructure"
229," Not only the physical infrastructure such as roads, bridges, and flood protection, but also the infrastructure that supports strong workforce, strong families, and strong communities"
230, Both of these types of infrastructure are necessary for us to thrive
231," Let's take a look at the huge strides we've made this past year and where we need to do more in the future, especially on workforce"
232,  We entered 2021 with a bold proposal to our legislators: to pass the largest infrastructure bonding package in state history
233," Listening to the warnings of economists and reading the writing on the wall, seeing all the federal money being printed, we predicted that inflation would soar over a year ago with a massive influx of federal government spending, and also inflation because I have to say, the current administration's misguided economic policies, which are driving energy prices up"
234,"   Turns out we were right, unfortunately"
235," But last week, we learned that inflation had climbed to the fastest pace in 40 years, up a staggering 7"
236,5% from a year earlier
237, And North Dakotans are feeling the pinch
238," As inflation rises, so does the cost of borrowing money and higher interest rates"
239,     That's why we pushed so hard to pass our historic bonding bill last spring
240," That swift action, those bonds have already been issued, low interest rates have been secured"
241, They're taken at a time when interest rates were at a historic low
242," This is going to save, the legislature taking action last year is going to save tens if not hundreds of millions of dollars as we upgrade our roads and bridges, build new flood projects, and finish the ones we've started, work on water supply projects for our citizens"
243,"  And we are wisely using the Legacy Fund earnings, not the principal, the earnings, to pay off those bonds, so we don't have to use $1 of taxes of the state citizens"
244, This was a financially conservative thing to do
245, We thank our legislators for embracing the tool of bonding at this strategic time
246,"   With the costs of goods, services, and materials rising, we've moved quickly to get the biggest bang on our federal dollars that have come through"
247," And while some states were waiting until their regular session, our legislature acted"
248, They moved quickly
