,0
249," With a special session, we deployed those ARPA dollars in November"
250, And we're avoiding some of the corrosive power of inflation and putting ourselves at a competitive advantage over states that have yet to act on their federal aid
251, That's smart
252," It's conservative, and it's really great in terms of how we're doing cash management"
253,"   In this biennium alone, we've made a record level of strategic investments in infrastructure, $2"
254,3 billion
255, That brings our five-year total in our administration to over $6 billion invested in physical infrastructure
256,"  And this of course, right here, since we're in Fargo, we need to mention the $435 million bonding package for the Fargo, Moorhead, West Fargo, Horace, Harwood area diversion project"
257," That enabled the project officials, that bonding, to close the contractor agreement, lock in lower pricing through a private-public partnership"
258," In fact, the U"
259,S
260," Army Corps of Engineers has estimated that because of that action taken last year, and now the bidding with the private-public partnership completed, without that the diversion would've taken until 2042, 15 years after what is now the estimated completion date"
261, That cost of taking 15 years longer would've been $330 million more
262,"  Instead, the diversion is now 35% complete"
263," Substantial completion is slated for spring of 2027, reducing catastrophic flood risk to a metro area that includes over 20% of the K-12 kids in our state, over 25% of the current hospital capacity in our state, over $25 billion of property value, and an entire university and 55 and growing K-12 schools"
264," This protection, protecting this metro area, this couldn't have happened without the work of our legislature, without the work of city and county leadership across the border into Minnesota"
265, Wouldn't have happened without the work and collaboration with the state of Minnesota and their governors
266," And it wouldn't have happened without the hard work of our Congressional delegation, especially Senator John Hoeven, who helped secure the federal funding that completed the whole project"
267,"    By completing this project faster, we're reducing risk"
268, We're saving homeowners thousands of dollars each
269," Cumulatively, it's tens of millions of dollars annually being saved that will no longer have to go towards flood insurance in the metro area"
270," And we're protecting all of this property value, all the hospitals, everything I've talked about"
271," So it's really incredible, but so many people in this room were involved in that"
272," But I do want to say one other thing because I look around the room and I know there's people here that I've been with, and we've been shoulder to shoulder"
273, And we've been stacking sandbags for the last – my lifetime in Fargo
274," So anyway, I'd just like to say I think I've done enough stacking of sandbags"
275," So I want to thank everybody that was involved in this, to say thank you"
276, It's about time we got this thing done
277,"  Before Governor Guy passed away in his 90s, and he'd grown up Amenia, my dad grew up in Arthur, they knew each other from college at NDSU"
278, They were in the same fraternity
279, They knew each other
280, They both signed up for World War II at the same time in a line in Casselton at the gym
281," He asked me about 15 years ago to go out to lunch, and when I was just working here in Fargo"
282," And what he wanted to talk about was, and it was after we'd had some big floods in Fargo, and he wanted to talk about, hey, you know in the '30s, there was a drought"
283, It was an extended drought
284, The city almost ran out of water
285, He'd been working on Garrison Diversion as governor from 1960 to 1972
286," He's like, ""That's something that has to get done"
287,"""   This legislature has committed an additional $50 million for the Red River Water Supply Project"
288, It's going to provide emergency water supply to central and eastern North Dakota
289, And we're talking about providing water to 40% to 45% of the people in the state
290, We're talking about the entire Red River Valley and everything that's outside of the Missouri River Basin
291, It's a huge piece of our economic engine
292, But we're going to have this backup water supply
293," It's only been promised, it's been pursued, it's been planned, for six decades"
294, It's going back to the '60s
295,  We're finally getting ready to have a drop of Missouri water cross the continental divide and come to the eastern part of the state
296," This is why we went through the pain of flooding the land, the tribal lands, the state lands, flooded all of this great bottom land in the Missouri River, which everybody loves now for fishing, but all that flooding of all that acreage was meant to provide a million acres of irrigation and water supply for the rest of the state"
297, That was the vision of Garrison Diversion
298, It wasn't all about fishing
299," We love the fishing, but it's not a million acres, we're irrigating about 11,000 acres"
300,  There's not been a drop of water come to the east
301," We finally have a chance to get this thing done, that along with NAWS to get Missouri River water up to the north central part of the state, Minot and the Souris River Basin"
302, These are huge things
303, The legislature understands this
304, They're investing in this infrastructure
305, And this will provide more certainty and resiliency for our farmers and ranchers in the rest of our state
306, They know they can rely on the abundant clean water supply provided by the Missouri
307," And like flood protection for Fargo, these water supply projects, super critical"
308, It's about time
309, Give yourselves a hand for helping to make this happen
310," Way to go, team"
311,"    And of course, these days in addition to the physical infrastructure of water projects, bridges, highways, whether it's telehealth, behavioral health, education, connecting every combine and every tractor, we have got to have the world's leading broadband access"
312, And we continue to position ourselves in that way
313, State lawmakers committed an additional $45 million in federal funds for building out our broadband infrastructure
314, We already led the nation before that $45 million investment
315," We literally were the best in the country in terms of when the pandemic hit, we could reach 99% of our students had an access to internet at home"
316, That was higher than any other state in the country
317, We can be the first state in the nation to achieve 100% broadband access
318,  And we're not talking dial up speeds
319, We're talking gigabit type speeds
320," Why does that matter? It levels the playing field for everybody as a citizen, and for students, and it levels the playing field for our small communities where people can now literally work from anywhere for almost any company in the world, regardless of geographic or demographics"
321, It is a huge advantage
322, We're in the front
323, Let's keep building on our lead
324, Let's make it happen
325," Way to go, North Dakota"
326,"  ***  But as we invest in all this future, some people might say, ""Wow, where are all the dollars going?"" But I want you to know again, working with the legislature, we're also saving for the future"
327,"   Thanks to conservative budgeting, prudent fiscal management, our state's reserve funds are in better shape than they ever have been"
328, The rainy day Budget Stabilization Fund sits at $750 million
329," In Century Code, that's it's cap, that's as filled as it can fill"
330," The Strategic Investment and Improvements Fund will have an unobligated balance of more than $900 million, unobligated balance in just a cash checking account by June of 2023 if the current oil prices continue"
331," And based on the current conservative forecast, and I say conservative because we've been tracking ahead of that the first eight months of this biennium, the Legacy Fund will have nearly tripled in value in just eight years by the end of this biennium, from $3"
332,3 billion in 2015 to $9
333,3 billion
334,   These reserve funds and our strategic use of federal funding has allowed us to provide historic tax relief during this special session
335," We approved an estimated $211 million in income tax credits, allowing approximately half, half of North Dakotans, get to keep their hard earned money"
336," The people that were working during the pandemic were the people that have income tax to pay, they get to keep their money in their pocket"
337," We also have permanently eliminated the state income tax on Social Security income, saving our seniors nearly $15 million over the next two years"
338,"   We know that when it comes to taxes though, our citizens are concerned about property taxes"
339, Property taxes are locally levied
340, This is the thing that hits many of our citizens the hardest
341, And the state has been for the last decade trying to do their part to lessen that impact
342, The current   budget includes $175 million in local property tax relief because the state continued to cover the cost of county social services that used to be done by local property taxes
343, The state also is providing $1
344,2 billion in property tax relief through a school funding formula this biennium
345," That's this biennium, $1"
346,2 billion that would only a decade ago have been paid locally is now being paid by the state
347,  But we still have a problem
348," With inflation coming, with people moving to North Dakota, with supply chain issues, property valuations are rising, home prices are going up, inflation is driving properties up"
349," When property values go up, valuations go up"
350," And unless a school district, a city and a county, or a park district, unless they lower their mill rate, unless they lower their tax rate, their revenue's going to go up"
351," So as citizens, we can have local officials say, ""We didn't raise your taxes,"" but they're getting more revenue with inflation"
352," And everybody calls their state legislator and says, ""Do something about property taxes"
353,"""  We have to fix the problem at the local level"
354," It's up to all of us as North Dakota residents to ensure that when we're doing these local property tax dollars, to ensure that when we're doing this thing, that we're giving feedback to those locally elected leaders, and that they're making smart decisions, and that they're being used effectively and as efficiently as possible at the local level"
355,"  We've made progress on tax relief, but we can't stop there"
356, We need to continue finding ways to simplify our tax code
357," We need to create a better business tax environment, particularly now when we're competing"
358, We need to make sure that we're cutting red tape and cutting regulation to make sure that people that want to live in our state can
359," And we have to make sure that any attempt at state-funded property tax relief actually finds its way to the citizens, rather than being slowly eroded through property value increases, fiscally uneconomic premature growth of public-funded infrastructure on the edges of our city"
360,  This economics piece is simple
361, Private capital that flows to an area in any city where there's existing infrastructure is a winner for all taxpayers
362, Public capital projects on the Greenfield edges of our communities literally do not pay for themselves and cost taxpayers money
363, This is a lesson we need to learn at all levels of government
364, Continued smart tax reform is the key priority over the next 10 months
365," Our administration will work with the state tax commissioner, OMB director, key legislators, to work to bring meaningful tax reform proposals to the 68th Legislative Assembly in North Dakota"
366,"  We've got the smarts, the brains, and the people and the dollars to be able to fix this"
367, And it starts with how we design our communities
368, Our citizens work hard for their money
369," We should work even harder at government to make sure that we aren't taxing them, that we're not taxing them unnecessarily and that we're not designing cities that aren't sustainable financially into the future"
370,  ***     The adversity that past generations overcame on these unforgiving plains has been passed down as the North Dakota work ethic that we know today
371,"   Our farmers and ranchers take great pride in their productivity, and they should"
372," In spite of that record-breaking drought, a global pandemic, a federal administration that seems bent on opposing our state, our farmers and ranchers have continued to show the way and why they lead in feeding the nation"
373," As of this last year's harvest, North Dakota continued to lead the nation in edible beans, canola, flaxseed, and of course, very sweet that we lead in honey"
374," Remaining the top five, barley, chickpeas, oats, sugar beets, rye, sunflowers, and wheat"
375," Corn, wheat and soybeans are still our top three crops"
376,   And our citizens have always been innovators
377, Our farmers have always been leaders
378, They've always been driving their productivity forward
379,  And this can be seen by the Grand Farm project here in Cass County
380," Just this week, along with over a dozen legislators that were present, we announced that Grand Farm will receive a $10 million grant"
381," And this is something that had been proposed in our Accelerate ND, the legislature approved it in November"
382, It's going to be matched with private dollars to take at a national and international level for this area to lead the world in autonomous ag technology
383,"   The opportunities for collaboration using the Grand Farm vision, tying together NDSU, our Extension, which touches every county in the state, the huge private sector investments that we have in agriculture and agriculture automation and investment in technology here in our state"
384," We've got a potential to transform agriculture here at home, and at the same time, address the workforce challenges that face the agriculture industry"
385," Our leadership in ag tech, it doesn't stop there"
386,"  Bushel, an ag tech software company located right here in Fargo, is a leader in digital infrastructure for the grain industry"
387, Their technology has led to the largest network of growers and grain buyers in the United States
388," Currently, more than 60,000 farmers, 2,000 grain handling facilities in the U"
389,S
390, and Canada are utilizing Bushel's innovative technology
391,"   In 2020, with the support of Commerce’s innovation and technology loan fund, Bushel was able to expand even further and add additional team members"
392," Bushel's CEO and co-founder, Jake Joraanstad, was helping lead this charge"
393, He's not able to be here in person today
394," But Bushel's vice president of product, Dane Braun, and director of engineering, Nathan Joraanstad, are here to represent the company as an example of how North Dakota can lead in ag tech"
395," Let's hear it for Dane, Nathan, and Jake, and the entire Bushel team"
396, You guys should watch out
397," The last time we announced a company at the State of the State, six months later it got bought for $9"
398,6 billion
399," But you guys are on a good roll, way to go"
400,"   ***    Our ag industry can thrive without a healthy energy – our ag industry, I'm sorry, can't, cannot thrive, especially today, without a healthy energy industry to provide stable baseload power, reliable natural gas, propane and other fuels"
401," And then also, they fuel those value-added plants, but it's also that energy is the value-added feed stock for creating fertilizer"
402,"  Likewise, on the flip side, our energy industry needs a healthy ag industry to survive"
403, Agriculture creates markets for our energy products and value-added products
404," We today support a $632 million and growing ethanol market in North Dakota across four plants, and that creates a local market for over 180 million bushels of corn"
405," Never before like we are right now, ag and energy need each other"
406," And we're so uniquely positioned compared to almost any other state because we've got these two powerhouse industries, ag and energy"
407, And they can work together
408,"  But what's happening to both of them, nationally there's a movement of capital away from traditional investments in both ag and energy"
409," These investments are based on what's called ESG, environmental, social, or governance metrics"
410," They're driving more than $45 million – not million, sorry"
411," Not B, T"
412," $45 trillion in capital away from our two largest industries at a time when we need it most, when those industries need to be innovating, ESG is a form of regulation"
413," It's a form of shareholder pressure, which is taking that innovation away"
414,"   According to the projections from the United Nations, global food production is going to need to double by 2050 to meet the demands of a growing global population, both for bodies and increase in need of protein"
415,"  Likewise, our energy industry is vital for ensuring our future survival"
416, Our nation is losing baseload energy production at a time when we need uninterrupted power
417," And again, the policies are trying to disrupt the things that have allowed us as a nation to never worry when we flip on a light switch because we've all spent our whole life knowing that without even thinking about it, we've had the best grid in the country"
418,  So Lieutenant Governor Sanford and myself and legislators and dozens of other people worked last spring
419, There was a dozen bills passed by the 67th Legislature to support ag and energy production
420," Bills that created the new Ag Diversification Fund, the Clean Sustainable Energy Fund"
421, These were historic and they're a great start
422, We recognize that there's even more opportunity in North Dakota
423," That's why in May of last year, we announced a goal of making North Dakota the first carbon neutral state in the nation by the end of the decade"
424,"  Of the 50 states, ours is the best positioned to help our nation and the world transition to a carbon constrained future"
425," And at the same time, providing reliable, resilient, affordable, clean energy for our children and grandchildren"
426, We can do both
427," In North Dakota, it is “and,” not “or"
428,” We don't have to give up stable baseload
429, We don't have to give up destroying our economy
430, We don't have to ask OPEC to produce more energy to lower the price of gas at a pump in North Dakota and across our country
431, We can produce that here today
432,    Our goal that we have of 2030 will involve no new mandates
433," It will be achieved purely through innovation, not regulation"
434," By focusing on innovation over regulation, we can harness the geologic jackpot under our feet in North Dakota to capture and store far more carbon than we currently produce"
435,   It makes total sense
436, We've got the technology
437, We've created the regulatory framework
438, The legislature on everything from pore space to unitization to becoming the first state in the nation that could authorize and permit a Class VI well for CO2 storage
439, We have the things in place
440," That's why the capital is coming here now like we've never seen it, because of the work that the legislature's done, the work that Lynn Helms and his team has done, Dave Glatt and his team has done"
441, We're in a position where we can attract ESG dollars for the first time instead of driving them away
442," And that $45 trillion is headed our way because we can solve problems today, not in the future"
443,  We are already global leaders in producing food and fuel efficiently
444, North Dakota ranks 10th in the nation in reducing carbon intensity from energy production over the last 20 years
445," With our technology, ag producers are gaining more efficiency with more than an eight-fold increase in row crop yields over the last century"
446,   Potential synergies between ag and energy keep coming together
447," Last year, they came together in one project in perfect harmony, as a great example"
448," After months of working behind the scenes, we were able to announce that ADM, a fantastic global company in ag and in energy and in fuels, will be building North Dakota's first dedicated soybean crushing plant and refinery at Spiritwood, 10 miles east of Jamestown"
449,"   This $350 million soybean crush and refining complex is going to create 70 permanent jobs, process 150,000 barrels of soybeans a day, roughly one quarter of our state’s soybean production"
450," It creates a huge local market for soybean growers, improves their profitability, reduces our dependence on having to ship soybeans in raw form to foreign competitors that we may be in trade wars with"
451, We can add value to it right here
452," So not only it's a win for ag producers, it's also a win for the oil refiners, and it's a win for the environment"
453,"  The soybean oil, this is a market that's going to be driven by oil, not by meal"
454, Soybean oil taken from that plant at Spiritwood will be shipped to the Marathon Refinery in Dickinson to be refined into renewable green diesel
455," It'll be sold into such states as California at a huge premium, maybe as high as $1 a gallon, to meet their fuel standards"
456,  So let's just stop for a second
457," We got a soybean that we used to grow, put on a train, ship it and export it"
458, Now we have a soybean
459," We take it, we process it, we turn it into soybean oil"
460," We take it and we process it again, turn it into green diesel in Dickinson"
461," We're adding value to that same soybean three times, not once"
462, This is how we keep tripling our economy
463, We can do this over and over and over again
464,    We have a diverse portfolio of over 50 different types of farm commodities in North Dakota
465, We can grow just about anything
466, We know we've got over 800 years' worth of lignite coal
467," People say so what? We decarbonize it, which we're doing right now, and it's one of the greatest baseload sources ever"
468," More than 26 billion barrels of recoverable oil, over 38 trillion cubic feet of natural gas, and with the sixth-best wind resource in the nation"
469," The all-of-the-above energy approach, we are truly positioned to both feed and fuel the world"
470,"  When we talk about having the jackpot of geology, look at those numbers"
471, It is incredible
472, We should get up every day and just pour gratitude out of ourselves that we were all North Dakotans sitting on top of this soil and these God-given resources
473, And now we've got the innovation to take advantage of them and do things that others around the world would only dream of doing
474, But this all-of-the-above requires balance
475, Government has got to figure out when the time is to get out of the way
476," We've got to figure out a way to ensure a level playing field so that the federal government trying to pick winners and losers across energy sources, as opposed to trying to support those that are doing the most to get rid the CO2"
477, Our baseload sources must continue to thrive
478,"  Last summer, we were pleased to announce that a buyer had been found for Coal Creek Station"
479," An entrepreneur, a risk taker, a North Dakota company"
480, This is our largest power plant
481," Not only has this saved 300 jobs at the plant itself at Coal Creek, but it's saving over 500 jobs at Falkirk Mine"
482," It also ensured that over 1,100 megawatts of baseload will remain on the grid"
483," That's not only good news for us and for Minnesota, who gets 45% of their electricity from North Dakota, but it's good news for Dallas, Texas the next time it gets cold in the South"
484,  This deal wouldn't have happened if we didn't have what we've been talking about
485," If we didn't have the associated carbon capture project that the state's been working on for over a decade, if we didn't have the regulatory framework, and we didn't have the ability to put our largest standalone wind farm right next there to also take wind energy and push it down that direct current line"
486, This all-of-the-above energy approach is working
487,"  There are so many people to thank on this, starting with the entrepreneurs and engineers"
488," Loren Kopseng, Stacy Tschider from Rainbow Energy, for their vision, for their tenacity, overcoming 20 different things that were put in front of the place"
489, Al Christenson from Great River Energy for his instrumental role
490," But leading the charge again on this example, Lieutenant Governor Brent Stanford"
491, So let's give everybody a hand for making this thing happen
492, Way to go
493,  We are already well on our way towards meeting our carbon neutral goal for 2030
494," In December, we approved the first round of grants from the Clean Sustainable Energy Fund that the legislature created this last year"
495, The approved projects from that first grant round will sequester 18 million tons of CO2
496, That represents over 31% of our current annual production
497, So we're off to a good start
498, But we know that we have the room to store so much more
499, We can store 252 billion tons of CO2 in North Dakota
500," That's 4,400 years of our state's annual carbon production"
501,"  But why stop with North Dakota? We have an enormous opportunity not just to store our own carbon, but to store our neighbors' carbon"
502," We can store the entire nation's CO2 for the next 50   years if people could figure out how to get it here, which is why it's exciting that we've got groups working on building CO2 pipelines to bring that CO2 here for us to store it 7,000 feet underground safely"
